,Date,Tweet
52,2022-05-09 11:29:18+00:00,"@karnt ทำตัว เป็นพรรคป้อม ก็เอาขยะไปรวมเพื่อได้จัดตั้งนายก
แล้วนางแบกก็บอกว่า วัดกันที่เสียง

ก็ไอ้วิธินี้และเหตุผลแบบนี้ เทือกมันถึงด่าใส่ร้าย
ได้เต็มปาก หลอกให้ สลิ่ม มันเชื่อไง

เพราะความจะเอาชนะ ด้วยวิธีดำๆแบบนี้
วังวน ไม่พ้น ละ

เพราะถ้าดูถูกสลิ่ม  สลิ่มมันถึงไม่สนที่ทหารยึดอำนาจ"
53,2022-05-09 10:53:10+00:00,"คนที่เชื่อคำพูดไอ้หมาตัวนี้ว่าล้มตู่ เพื่อให้ป้อมเป็นนายก
กูจะเตือนความทรงจำพวกมึงนะ
เพราะไอ้หมาตัวนี้ไงที่พวกมึงไม่ได้อภิปรายป้อม
แล้วพวกมึงก็ด่าเพื่อไทยยิ่งกว่าหมา
มาวันนี้พวกมึงกลับเชื่อไอ้หมาตัวนี้ ว่าล้มตู่เพื่อให้ป้อมเป็นนายก
พวกมึงไปเช็คสมองด้วยนะ
หรือไปกินขี้มันซะ https://t.co/nqkzY1ae0u"
54,2022-05-03 06:42:29+00:00,ฉันแบบ อะไรมันเกี่ยวอะไรเด็กรุ่นใหม่ แต่ถ้าพวกพี่อยากให้พูดมาค่ะ หนูจะพูดให้ เดะจะลามไปด่ายันไอ้ตู่ไอ้ป้อมรัฐบาล อย่าเปิดช่องนะ มาสิเดะก็หาว่าฉันหัวรุนแรง 555555555555 มาค่ะคุยกันสนุกมาเลย พูดมาเดะหนูด่าให้เถียง
55,2022-04-21 03:22:48+00:00,@chaikhiawkaew @yumiko_bada ครับขอให้สุขภาพแข็งแรง ทุกคนครับ มีความสุขกับปัจจุบัน ด่าไอ้เหี้ยตู่ ป้อม พปชร รัฐบาล ระบายความเครียด
56,2022-04-19 22:09:20+00:00,อดทนด่าใครก็ได้อะ แต่กับไอ้เหี้ยตู่ เหี้ยป้อม กับเหี้ยทั้งคณะไม่ได้จริงๆ
57,2022-04-17 03:56:50+00:00,@mortorsortor ได้โปรโมทประเทศ แถมได้ด่าไอ้ป้อมบนเวทีโลก จำได้ มันทุ่มงบ จัดโต๊ะจีนกินมะม่วงฟรี😁
58,2022-04-16 14:18:31+00:00,"@ImMyNewOne ผมด่าแต่ปรสิต, แมงสาป, ไอ้ตู่, ไอ้ป้อม, ไอ้บอด"
59,2022-04-13 09:00:16+00:00,@ManOnelife มันก็พอกันอะพี่ ทั้งนักข่าวถามห่าอะไรประชาชนไม่เคยได้ประโยชน์ ส่วนไอ้ป้อมด่าแม่งสามชาติก็ไม่หมด!! ตปท.เราจะไม่เห็นภาพแบบนี้ทั้งสองฝ่ายเลย
60,2022-04-12 10:08:01+00:00,@kamphaka อีกอย่างนะคำผกา สติค่ะสติ ทำไมในระบอบ ปชต. พรรคการเมืองใด ๆ จะถูกตรวจสอบและถูกวิจารณ์จาก ปชช.คนใด ๆ ไม่ได้ จำเป็นต้องเป็นเฉพาะฐานเสียงของพรรคเหรอ งั้นพวก พท.ก็อย่าไปด่า พปชร. ปชป. ภท. ไอ้ตู่ ไอ้ป้อม อย่าไปเสือกกับพรรคของพวกสลิ่มมันสิ
61,2022-04-09 18:01:28+00:00,ปารีณาลั่นจะแรงขึ้นล้านเท่า แค้นทุกคน ยันไม่ได้รุกป่า ด่าคนจุดพลุไล่ไอ้ขี้แพ้ ล่าคนอื่นให้จบแบบเดียวกัน  ป้อมตบหน้าตู่ ขึ้นป้ายหาเสียงตัวเองทั่วประเทศ ใหญ๋กว่าทุกคนในแผ่นดิน https://t.co/9O3FrXPHDX ผ่าน @FacebookWatch
62,2022-04-05 08:05:47+00:00,@MatichonOnline โถไอ้ป้อม มึงอย่าเกณท์คนมาเชียร์สิ แล้ว ให้ไอ้ตู่ออกแทนมึง คนบ้ามันยังด่า
63,2022-04-02 05:51:29+00:00,ทีมเหี้ยมากกูทนไม่ไหวมากด่ากันแม่งทั้งเกมส์กู(โร้ค)กับคองช่วยกันดันป้อมทั้งเกมส์แต่ไอ้พวกที่เหลือแม่งมัวแต่ยืนพิมพ์ด่ากันทั้งเกมส์จนแพ้กูห้ามมันอีแวนแม่งด่ากูว่าเสือกไอ้ฉิบหายเกมส์แม่งห่วยฉิบหายเลยที่ไม่มีวิธีการจัดการกับคนท้อกซิกแบบนี้ #rovth https://t.co/2Bx3TXcEnq
64,2022-04-01 15:39:19+00:00,ตั้งแต่เล่นมาพึ่งเคยโดนด่า ไอ้เหี้ยเฟลชิบหายอะ พวกห่านั้นก็ปากแจ๋วกันชิบหาย ป้อมกูก็ตีลอร์ดก็กูตี แม่ง
65,2022-03-25 06:10:34+00:00,หัวร้อนมาก กุไม่เคยหัวร้อนขนาดนี้ แม่งบอกให้ดันป้อมเอาแต่ไล่คิล ด่ากันอยู่นั่น ไอ้ควาย เด็กเอฟเอฟหรอมึงอะ
66,2022-03-25 00:39:07+00:00,"สังคมไหนไปรุมด่า ไอ้ที่ภามว่าทำไมไม่ช่วยๆ ไม่ใช่นักข่าวเหรอ ในคลิปเป็นดำๆจุดเล็กๆมองยังไม่รู้ว่าใคร

หรือ ว่าชาวบ้านใกล้ๆเรียกคนในสังคมมารุมด่า

ถ้าใช้คำว่ารุมด่าต้องแบบ ลุงตู่ ลุงป้อมโน่น https://t.co/cqDZlHWuE9"
67,2022-03-23 10:03:38+00:00,@JJJJJJ427 ด่าไอ้เหี้ยป้อมด้วยนะ
68,2022-03-23 08:50:15+00:00,@tanawatofficial มึงลองเปิดตา&amp;เปิดสมองอันน้อยนิดดู แล้วจะรู้ว่าคนเค้าไล่ทุกวัน/ด่าทุกวัน/สาปแช่งทุกวัน แต่มึงก็ยังหน้าด้านที่ยังอยู่ค่ะไอ้ป้อม 🤬🤬
69,2022-03-22 18:26:02+00:00,Kuyคิวเลน กูไม่รู้จะด่ามึงยังไงดี แม่ง เข้าไฟต์ช้าชิบหาย ปล่อยเพื่อนตายละค่อยเข้า ละคือครีปเข้า4จะ5นาทีละ แทนที่จะตีป้อม เสือกไปตีกรเล็ก กูไม่รู้จะด่ามึงว่าอะไรดี ไอ้เหี้ย หงุดหงิดมึงอ่ะ
70,2022-03-20 10:47:13+00:00,"@RsmlP ลิซ่า นี่โดนมากกว่าคำว่า “วิจารณ์” เยอะเลยนะคุณจป.
ชาวทวิตส่วนใหญ่แม่งด่าลิซ่าหนักกว่าด่าไอ้ตู่ไอ้ป้อมไอ้เทพเทือก ฯลฯ ซะอีก
- ด่าชาติกำเนิด
- ด่ามารดา
- ด่ารูปลักษณ์
- กดเหยียดให้ต่ำทุกทาง
ฯลฯ

บรรดาไอ้อีทั้งหลายที่นำพาประเทศมาถึงจุดนี้ เคยโดนด่าเท่านี้มั้ยล่ะ?
😌"
71,2022-03-19 21:53:55+00:00,@bypetapan อยากตีป้อมมาเร้วๆพี่หลงหสูเล่นโง่อย่าด่าหนูนะให้ด่าไอ้หวาน
72,2022-03-19 05:39:01+00:00,"@Gilg_kun ไอ้ตู่ไอ้ป้อม นัดพรรคเร้กพรรคน้อยแดกดินเนอร์หรูหรา
สลิ่มมันด่าอะไรบ้างมั้ยคะเนี่ย
😌"
73,2022-03-16 16:48:20+00:00,ไอ้... กดโซโล่เเร้งตอนกลางคืนนะ ประสาทจะกิน เล่นโง่ โง่กันทั้งหมด ไม่ได้ด่าเกินจริง ไปย้อนดูเอาเอง มันอยู้เเร้งระดับนี้กันได้จริงหรอว้า เลนไม่ดัน คีพไม่เคลีย ป้อมไม่เอา มังกรก็ไม่เอา ไม่เอาสักอย่าง เล่นเกมเดียวกันไหมเนี้ย
74,2022-02-26 13:15:28+00:00,ถ้าไอ้เหี้ยป้อมตายคาตำแหน่งนี่คือ ที่สุดแห่งความระยำ จนไม่รู้จะด่าแม่งยังไง
75,2022-02-24 20:03:38+00:00,"คือถ้าด่ารัฐบาลว่าไม่ใส่ใจหางบมาใ้ห้งานกู้ชีพบ้าง จัดสรรงบยังไงวะ อันนี้โอเค

แต่ที่ออกมาแนว ไอ้พวกรัฐบาลมัวทำอะไรอยู่ หลับกันหมดแล้วรึไง คือคาดหวังอะไรเหรอ คือตาป้อมต้องลงไปประดาน้ำงี้เหรอสู"
76,2022-02-23 06:14:45+00:00,ได้ยินน้องเล่นเกม แล้วเพื่อนน้องพูดกับคนที่แพ้ส่า ไอ้ไก่ ไอ้กาก ไอ้ตุ๊ด นี้เลยให้น้องปิดเกม แล้วเราก็ถามน้องชาย 9 ขวบว่า ที่เพื่อนด่าคนอื่นว่าตุ๊ด เพราะอะไร น้องเลยบอกว่าคนนั้นชอบหลบเข้าป้อม
77,2022-02-18 04:48:10+00:00,@PILM38088309 @V2Yogurt ผมว่าคุณก็โยนหน้าที่ให้แครี่มากเกินไปนะ บางเกมมันไม่ได้ใจดีกับแครี่เลนตลอด เสียเวลาเดินมาช่วยมันก็ไม่ตายหรอกครับ ยอมเสียป้อมเลนแครี่ ยอมเสียให้แครี่ไม่เกิด คุ้มหรอครับ แล้วไอ้ที่บอกว่ายอมตายๆบ้าง ถามจริงฝั่งโน้นจะไม่เกิดหรอ แครี่ตรงข้ามก็เกิดสิ พอเกมเละก็มาด่าแครี่ มาให้รายงานกัน
78,2022-02-17 04:56:12+00:00,ป้อม มันคงนั่งหัวเราะ เวลาคนด่าไอ้ตู่และบอกว่า สมน้ำหน้า 😜 https://t.co/aTxrnLUcBJ
79,2022-02-04 05:52:32+00:00,@14ttir @noname_8 @KillerPress ไอ้นี่แหละตัวแสบที่สุด ในบรรดา 3 ป. เห็นทำตัวเงียบ ๆ ก็เพื่อให้ ป้อม กับ ประยุทธ์ โดนด่าแทน นั่งคุมมหาดไทย ทั้งอำนาจและผลประโยชน์มากมายมหาศาล แต่ไม่ต้องถูกตรวจสอบบัญชีทรัพย์สิน
80,2022-02-02 11:47:45+00:00,กูไม่ด่ามึงก็ดีเเค่ไหนล่ะ เกมมันจบป้อมไอ้ควาย
81,2022-01-26 18:47:28+00:00,มึงจะด่าลุงตู่เรื่องอะไร ไอ้บอล... ลุงตู่ก็พูดถูกแล้วนี่ เช่น พวกมึงปิดถนน เผาป้อมตำรวจ เผาทรัพย์ของทางราชการ มึงว่ามันอยู่ที่กฎหมาย หรือมันเป็นที่สันดานของพวกมึงล่ะ ไอ้สัส? https://t.co/TnxSbC3iy6
82,2022-01-26 07:55:10+00:00,"@anona_ava จริงตลกเรื่องนี้มาก เก็บความลับไว้ตั้งนาน
แต่ถูกเปิดเผย ก็เพราะกล่าวหาโจมตีพรรคเพื่อไทย
หาว่าไปดีลกับไอ้ป้อม
สุดท้ายโดนคุณวัฒนา
จัดให้สักดอก(ถ้าไม่สุดจริงเขาคงไม่มาโพสต์แบบนี้ บางทีไม่พูดไม่ใช่ว่าไม่รู้)
แล้วเป็นไงทีนี้นัดไปทานข้าว
ไปไหว้ขอโทษกันอยู่ในมุมมืด
แต่แถลงด่าในที่แจ้ง https://t.co/cvNkyk7VQp"
83,2022-01-25 08:29:46+00:00,"ไอ้หมอหื่นกาม จับ หอม โอบ ไม่ด่า
ป้อมจับไหล่ยืนคุย บอกโดนคุกคาม 🤣"
84,2022-01-12 14:16:14+00:00,ชอบเอเน้อจี้ความที่แม่โทรมาเรียกให้ไปซื้อของตอนเล่นซุปเป้อวอร์แล้วกุเรียกคลิ้นไอ้ฝุ่นมายิงป้อมให้รีบแตกมาก ปิดเกมภายในห้านาที เพราะช้าแม่จะด่า เหี้ยชะมัด เกมไวก้มา555555555555555
85,2022-01-09 03:57:44+00:00,@thaipost ไอ้ตู่ ไอ้ป้อม ไอ้หนู...มันฉีดก่อนใคร..มึงไม่ตามไปด่ามัน
86,2021-12-26 14:27:32+00:00,@AmaratJeab ไอ้ป้อม...ไม่รู้ ไม่รู้ ไม่รู้ พูดเป็นอยู่คำเดียว แต่เวลาด่านักข่าวฉอดๆๆๆๆ ด่าชัดมาก ต้องให้อันดับ 1 บุคคลปากสุนัขแห่งปี🐕🐕🐕🐕
87,2021-12-21 12:48:19+00:00,เรื่องธงชาติไทย​  ถ้าจะด่าในระดับรัฐมนตรี​ คนที่น่าด่าที่สุดก็คือไอ้ป้อมประวิตรใช่ปะ​ ในฐานะประ​ธาน  อลป. ไทย​ หรือไม่?
88,2021-12-15 14:39:39+00:00,"ขนาดหัวโจกอีป้อมยังคิดว่าคลองแสนแสบเดินทางวันละ1,000คน
ไอ้สัสเอ้ย!!ด่าพวกมึงยังไงดีว่ะ?!
นั่งแต่ลีมูซีนตั้งแต่เรียนนายร้อยเผลอๆ50ปีละมั้ง
ชาวบ้านเค้าเดินทางใช้เรือกันวันละเป็นหมื่นคนครับ
มึงเคยมานั่งมั้ย?อีเอ้ด้วย!สลิ่มด้วยเคยมั้ย ยืนเบียดจนเปนผัวเมียกันอยุ่ละ ไอ้ห่า
#ผู้ว่ากทม https://t.co/yoljAlHqzy"
89,2021-12-14 17:37:52+00:00,นานไปเขาก็ค้นพบว่ายูจุงฮยอกมันโครตน่ารัก เป็นคนที่แหย่สนุกอย่างไม่น่าเชื่อ ปากถึงจะชอบด่าเขาแต่พอเขาบอกให้ปรับปรุงตรงไหน ตาถัดไปก็จะแก้ไขทันที ไอ้หน้าหมานี่เชื่องดี…เขามองใบหน้าหล่อเหลาอย่างเหม่อลอย ให้ตายเถอะ…เหมือนหมอนั่นชะมัด ยูจุงฮยอกที่จบด้วยการตีป้อมฝั่งตรงข้ามหันมามองเขา
90,2021-12-06 22:36:57+00:00,เผลอนอนไวเลยเพิ่งตื่นเห็นข่าวทหารใช้กำลังสลายกลุ่มพี่น้องจะนะที่มาชุมนุม โอ้ย ไอ้เหี้ยตู่ไอ้เหี้ยป้อม จะให้ด่าตรงไหนก่อน พวกมึงนี่เสวยสุขบนเงินภาษีไม่เคยเหลียวแลคนลำบากคนทุกข์เลยนะ ชาติเปรต เมื่อไหร่โรคประจำตัวจะทำงานสักที
91,2021-12-06 03:26:28+00:00,พิพิธ นี่พูดเหมือนไอ้ป้อมด่านายพลที่ไปอยู่ก้าวไกลเลย อย่าเนรคุณองค์กร เผด็จการยันผ้าเหลือง
92,2021-12-01 12:13:57+00:00,ด่าไอ้ป้อม แต่ตัวเอง พูดไม่รู้วๆ 🤣🤣🤣🤣🤣🤣🤣🤣
93,2021-11-28 06:03:15+00:00,"@Sean40niner เอาจริงๆนะ​ เดวด่าไอ้ตู่​ เดวตีไอ้ป้อม​เดววนมาร้องเพลง
อ่ะเราใกล้ละ"
94,2021-11-27 13:38:22+00:00,ไอ้พวกเสี้ยม อยากลากคอมาด่า /“บิ๊กป้อม” ลั่นไม่มีวันแตกแยก “น้องตู่” ยกเว้นความตาย ประกาศคว้า ส.ส.กทม. 24 ที่นั่ง https://t.co/UveL4vbrp2 https://t.co/exAgWmPnYt
95,2021-11-19 12:14:27+00:00,เพราะมันเป็นแบบนั้นมาแต่แรกแล้วจริงๆ ไม่ใช่ตั้งป้อมคอยที่จะเหยียบถ้ามีอะไรพลาด ไอ้ที่มากราบเท้าเวลาได้ดังใจ แต่จะคอยเหยียบเวลาไม่ถูกใจขึ้นมา อย่าทำเหอะ เพราะ ดนต. ก็จะไม่ทนเหมือนกัน แค่เบื่อ กับเปลืองเวลาชีวิตเฉยๆ แต่ถามว่าปล่อยวางมั้ย ก็ไม่จ้าาาาาา ด่ามา ด่ากลับ แฟร์ๆ
96,2021-11-18 11:32:00+00:00,น่าเบื่ออะ กูเสียเวลาชีวิตตัวเอง ชีวิตกูตกต่ำสุดๆ เคว้งคว้างเหี้ยๆ มาสามเดือนเพื่อมาด่า รบสต เนี่ยนะ ทำไมชีวิตกูเกิดมาถึงต้องมาเจอเรื่องแบบนี้ด้วยกูอยากจะร้องไห้ ฮือออออ T^T อีตู่อีป้อมจกกีไอ้พวกทหารตำรวจส้นตีน กู fuck you all ให้หมดเลยอีเหี้ย!! ขอให้เป็นแบบกูด้วย ทรมานเหมือนกูซะ
97,2021-11-06 08:45:16+00:00,"ที่ลากลิซ่าไปด่าเพราะลิซ่าเป็นคนอีสาน เอาง่ายๆมันพาลไปทั่ว อะไรที่หาแสงให้มันได้มันพูดหมด สนุกปากกันไม่กี่นาที
แต่ตอนนี้แม่น้องลิซจะฟ้องแล้วเพราะด่าลูกเค้าแรงมาก ก็เลยหงายการ์ดไม่รู้ๆๆๆ
เป็นไอ้ป้อมเลย กูล่ะอย่างชอบ สภาพ5555555555555555555555
#คลับเฮ้าส์toxic"
98,2021-11-03 11:16:14+00:00,เอารูปไบเดนหลับมาด่า เอารูปผู้นำประเทศอื่นมองโพยมาขำ แต่ไม่เคยเห็นนายกบ้านเราเป็นใบ้ ไม่เห็นไอ้ป้อมหลับตลอดเวลา งง
99,2021-11-01 04:13:32+00:00,@nooknitithorn ติ่งส้มดิ้นเพราะกลัวอีทิมไม่ได้เป็นนายก ฟังกูนะมึงไม่ต้องกลัวค่ะ เพราะยังไงก็ไม่ได้เป็น เลิกฝันหวานแล้วหาวิธีเอาไอ้ตู่กับลูกน้องอีป้อมออกไปไกลๆเก้าอี้นายกให้ได้ นี่คือสิ่งที่พอจะทำได้และมีโอกาสสำเร็จ ส่วนอีทิมเป็นนายกมหยุดเพ้อค่ะ เสียเวลาเปล่า กูไม่อยากด่าว่าโง่ ควรรู้ด้วยตัวเอง
100,2021-11-01 04:12:16+00:00,ติ่งส้มดิ้นเพราะกลัวอีทิมไม่ได้เป็นนายก ฟังกูนะมึงไม่ต้องกลัวค่ะ เพราะยังไงก็ไม่ได้เป็น เลิกฝันหวานแล้วหาวิธีเอาไอ้ตู่กับลูกน้องอีป้อมออกไปไกลๆเก้าอี้นายกให้ได้ นี่คือสิ่งที่พอจะทำได้และมีโอกาสสำเร็จ ส่วนอีทิมเป็นนายกมหยุดเพ้อค่ะ เสียเวลาเปล่า กูไม่อยากด่าว่าโง่ ควรรู้ด้วยตัวเอง
101,2021-10-24 03:15:20+00:00,จริงๆเราแบบเป็นคนไม่ค่อยหัวร้อนกับแก้มเลยเว้ย ใครด่าก็ขอโทษตลอด แต่ไอ้นี่ไม่ได้จริงๆ มอหอ กูฆ่าไม่ได้ก็ตีป้อมแม่ง
102,2021-10-20 17:41:10+00:00,ดูไว้ไอ้ควัย โดนแครี่ด่าว่าแท้งออกของโรมทำไม สาระแน กูเล่นแบบนี้มาเป็นชาติ ชนะตลอด กันให้มึงทั้งเกม กูบวกกูล็อก ก็ยืนอยู่ในป้อม หัวดอแล้วมาด่ากู อีหน้าปิ๊ https://t.co/4pR7QGxwOh
103,2021-10-14 16:01:30+00:00,@KhaosodOnline จริงๆ ไม่มีอะไรเลย ปล่อยให้เขาด่าไอ้เหี้ยป้อมก็จบแล้ว วินๆ
